{
  "id": "Taiko-20260621",
  "date": "2026-06-21",
  "title": "Taiko Bridge SGX Enclave Key Leak Exploit",
  "protocol": "Taiko",
  "blockchain": [
    "ethereum",
    "rust"
  ],
  "category": [
    "key_compromise",
    "bridge"
  ],
  "ecosystem": "evm",
  "language": [
    "solidity"
  ],
  "estimatedLoss": {
    "totalUSD": "1700000",
    "breakdown": [
      {
        "asset": "USDC",
        "amount": "675761.236201",
        "convertedUSD": "675761",
        "note": "Released from ERC20Vault via retryMessage"
      },
      {
        "asset": "ETH",
        "amount": "130",
        "convertedUSD": "490100",
        "note": "Released from Bridge via processMessage"
      },
      {
        "asset": "USDT",
        "amount": "138139.564343",
        "convertedUSD": "138140"
      },
      {
        "asset": "crvUSD",
        "amount": "156832.011092154729015188",
        "convertedUSD": "156832"
      },
      {
        "asset": "WETH",
        "amount": "20.70482",
        "convertedUSD": "78000"
      },
      {
        "asset": "WBTC",
        "amount": "0.42634415",
        "convertedUSD": "45000"
      },
      {
        "asset": "weETH",
        "amount": "0.530999165959580756",
        "convertedUSD": "1500"
      },
      {
        "asset": "CRV",
        "amount": "126160.973069281665593531",
        "convertedUSD": "50000"
      },
      {
        "asset": "iZi",
        "amount": "2140403.026072231869425941",
        "convertedUSD": "5000"
      },
      {
        "asset": "TAIKO",
        "amount": "1990000",
        "convertedUSD": "189120",
        "note": "Transferred to MEXC exchange"
      }
    ],
    "note": "Total estimated ~$1.7M based on Defi Nerd's L1 reconstruction. ETH price assumed ~$3,770 at time of incident. The per-asset convertedUSD values are approximate and their sum (~$1.83M) exceeds the rounded $1.7M total. The $1.7M figure is the consensus estimate from PeckShield, Phalcon, QuillAudits, and GoPlus; individual token USD conversions at exact attack-time prices would refine the sum."
  },
  "attackTime": {
    "startTime": "2026-06-21T19:03:59Z",
    "endTime": "2026-06-21T22:28:11Z",
    "isRange": true,
    "date": "2026-06-21",
    "note": "Setup/proof batch tx at 19:03:59 UTC (block 25367938). L1 asset releases from 22:07:23 to 22:28:11 UTC (blocks 25368853-25368955). Taiko official security notice at 2026-06-22T00:49:14Z."
  },
  "transactions": [
    {
      "txHash": "0x2f44dc1b883522a88f9b0cbbdfabf9ec33884b69dd4326600c3fab7fb2277260",
      "blockchain": "ethereum",
      "role": "setup",
      "description": "Setup/proof batch: attacker EOA called executor via execute(bytes) [selector 0x09c5eabe]. Executor called SgxVerifier.registerInstance() [selector 0xa91951a2] twice, registering malicious SGX instances (IDs 5, 6). SignalService.saveCheckpoint() saved fake Taiko block 1805600 checkpoint. Bridge.processMessage() [selector 0x2035065e] called 10 times, setting 10 forged messages to RETRIABLE status."
    },
    {
      "txHash": "0x017292a7de5fef52a3274e37dda5ace4c4d0cdafe91b7b4ac9c700f02fae35ee",
      "blockchain": "ethereum",
      "role": "exploit",
      "description": "USDC release: retryMessage() [selector 0x0432873c] released USDC from ERC20Vault to attacker EOA 0x7506.... This was the first USDC release tx; total USDC stolen across all drain txs was 675,761.236201."
    },
    {
      "txHash": "0xb8befb015a67de8f40890b1f8667c597c3b66a52b388ec1c6cd28637fd65dd13",
      "blockchain": "ethereum",
      "role": "exploit",
      "description": "ETH release: processMessage() released 130 ETH from Bridge to attacker EOA 0x7506..."
    },
    {
      "txHash": "0x451423923ab3df56ce436a921d34d782681cf698b72ca61ad6b8a8b2aeee53b7",
      "blockchain": "ethereum",
      "role": "exploit",
      "description": "Major drain transaction (block 25368955, 22:28:11 UTC). processMessage() [selector 0x2035065e] called on Bridge, releasing additional assets to attacker. Verified on-chain: status=0x1 (SUCCESS)."
    }
  ],
  "attackers": [
    {
      "address": "0x7506DeA0c38ca0B55364B22424374c5A1ae1B76a",
      "blockchain": "ethereum",
      "role": "primary_attacker",
      "accountType": "EOA",
      "description": "Main attacker EOA. Called executor contract, received stolen USDC/ETH/other assets. Transferred 1,990,000 TAIKO to MEXC exchange. Also held ~870 ETH (~$1.52M) at time of reports."
    },
    {
      "address": "0xa98035081fb739ebe9c8f80904668fb11438a846",
      "blockchain": "ethereum",
      "role": "primary_attacker",
      "accountType": "EOA",
      "description": "Second attacker wallet identified by QuillAudits. Received stolen funds alongside main EOA."
    },
    {
      "address": "0xe0df6fc36deb38dd11dc53d327475c2b2b0ab98a",
      "blockchain": "ethereum",
      "role": "exploit_contract",
      "accountType": "Contract",
      "description": "Executor contract called by attacker EOA via execute(bytes). Orchestrated SGX instance registration, checkpoint saving, and processMessage calls in a single setup transaction."
    }
  ],
  "victims": [
    {
      "address": "0xd60247c6848B7Ca29eDdF63AA924E53dB6Ddd8EC",
      "blockchain": "ethereum",
      "role": "protocol_contract",
      "accountType": "Contract",
      "description": "Taiko Bridge Proxy on Ethereum L1. Implementation: 0x2705b12a971da766a3f9321a743d61cead67da2f. Released 130 ETH and other assets to attacker via forged processMessage/retryMessage calls."
    },
    {
      "address": "0x996282cA11E5DEb6B5D122CC3B9A1FcAAD4415Ab",
      "blockchain": "ethereum",
      "role": "protocol_contract",
      "accountType": "Contract",
      "description": "ERC20Vault Proxy on Ethereum L1. Implementation: 0xb20c8ffc2dd49596508d262b6e8b6817e9790e63. Released USDC, USDT, crvUSD, WETH, WBTC, weETH, CRV, iZi to attacker via forged retryMessage calls."
    }
  ],
  "description": "On June 21, 2026, Taiko's bridge infrastructure on Ethereum was exploited for approximately $1.7M. The attacker leveraged a leaked RSA-3072 private key (enclave-key.pem) that had been committed to the public taikoxyz/raiko GitHub repository on a hotfix branch. This key was used to sign all of Taiko's SGX enclaves and served as the entire trust root for the protocol's L2 state verification mechanism.\n\nThe attack unfolded in two phases. In the setup phase (block 25367938, 19:03:59 UTC), the attacker EOA 0x7506DeA0c38ca0B55364B22424374c5A1ae1B76a called an executor contract 0xe0df6fc36deb38dd11dc53d327475c2b2b0ab98a, which: (1) registered two malicious SGX instances via SgxVerifier.registerInstance() with instance keys 0x4777a54ff81357c966d7d98eea88f0f54d969135 and 0x292468e78605eca39071165b5eac4c9707ba9813 — these passed DCAP verification because the attacker's enclave was signed with the leaked key whose MrSigner matched the on-chain trustedUserMrSigner; (2) saved a fabricated Taiko L2 block checkpoint (block 1805600) via SignalService.saveCheckpoint(); (3) called Bridge.processMessage() 10 times, each delegating to SignalService.proveSignalReceived() for source chain 167000 (Taiko), which accepted the forged proofs and set 10 bridge messages to RETRIABLE status. INSTANCE_VALIDITY_DELAY was set to 0, so the freshly registered SGX instances were immediately usable.\n\nIn the drain phase (blocks 25368853-25368908, 22:07:23-22:18:23 UTC), the attacker used retryMessage() and processMessage() to release canonical L1 assets from the Bridge (0xd60247c6848B7Ca29eDdF63AA924E53dB6Ddd8EC) and ERC20Vault (0x996282cA11E5DEb6B5D122CC3B9A1FcAAD4415Ab) to attacker wallets. No corresponding MessageSent events existed on Taiko's actual L2 — the bridge messages were entirely fabricated.\n\nAssets stolen included 675,761 USDC, 138,139 USDT, 156,832 crvUSD, 130 ETH, 20.7 WETH, 0.43 WBTC, 0.53 weETH, 126,160 CRV, 2,140,403 iZi, and 1,990,000 TAIKO. The attacker transferred 1,990,000 TAIKO (~$189K) to MEXC exchange and also used Tornado Cash for fund laundering.\n\nTaiko responded by pausing the L1 Bridge and ERC20Vault, halting block production, and coordinating with MEXC to suspend TAIKO deposits. The team later replenished the bridge 1:1 from its own resources so no user lost funds. The chain was back online by June 30, 2026, with the bridge fully backed again.",
  "rootCause": "The root cause was an operational key management failure: the RSA-3072 private key used to sign all Taiko SGX enclaves (enclave-key.pem) was committed to the public taikoxyz/raiko GitHub repository on a hotfix branch. This key functioned as the protocol's entire trust root for L2 state verification — its MrSigner value (SHA-256 of the little-endian RSA modulus) was stored on-chain as trustedUserMrSigner. Once the key was public, nothing distinguished a legitimate Raiko-built enclave from an attacker-built enclave signed with the same key. Two compounding contract-level design choices amplified the damage: (1) INSTANCE_VALIDITY_DELAY was set to 0, allowing freshly registered SGX instances to be used immediately with no time delay; (2) retryMessage() trusted the RETRIABLE status set by a single prior forged attestation rather than re-verifying the proof independently, turning one successful forgery into a repeatable drain primitive.",